{
  "schema_version": "1.0",
  "site": "https://brightleaf-bakery.example",
  "run": 1,
  "findings": [
    {
      "verdict": "confirmed",
      "id": "P1",
      "title": "The home page never says what the bakery sells",
      "category": "clarity",
      "description": "The hero heading and subheading are a brand slogan. No product noun (cake, pastry, bread) and no primary action appear in the first heading, subheading or first 150 words.",
      "user_impact": "Visitors cannot tell whether this is a bakery, a restaurant or a cookery school, so some leave before finding the order path and the rest guess where to click.",
      "root_cause": "The home page hero names the brand story instead of the product, which leaves first-time visitors unable to say what is offered.",
      "intended_behavior": "The hero is meant to create a warm artisan impression; that works only after a visitor already knows the business sells cakes.",
      "heuristic_refs": ["CL-01", "CL-03"],
      "evidence": [
        { "kind": "observed", "tier": "text", "url": "https://brightleaf-bakery.example/", "location": "Hero heading and subheading", "session": "S1", "log_ref": "S1-E01",
          "excerpt": "Crafted with care since 2009", "description": "In the five-second test the first-time visitor could not say whether the site sells bread, cakes, classes or something else." },
        { "kind": "observed", "tier": "text", "url": "https://brightleaf-bakery.example/", "location": "Hero heading and subheading", "session": "S2", "log_ref": "S2-E01",
          "description": "The low-literacy persona guessed a restaurant and said she would not know where to click to order." },
        { "kind": "observed", "tier": "text", "url": "https://brightleaf-bakery.example/", "location": "First 150 words of the page", "session": "L2", "log_ref": "L2-E01",
          "description": "CL-01 fails: no noun naming the product appears in the heading, subheading or first 150 words." }
      ],
      "reproduction": {
        "steps": ["Open the home page.", "Read only the first heading, the subheading and the primary navigation labels.", "Write down what the business sells."],
        "expected": "The visitor names the product (custom cakes and pastries) within five seconds.",
        "actual": "Visitors name a lifestyle, a restaurant, or nothing."
      },
      "affected_personas": ["first-timer", "low-literacy"],
      "severity": {
        "impact": { "score": "major", "reason": "Visitors can still explore, but they cannot tell what is offered or what to do first." },
        "frequency": { "score": "universal", "reason": "Every visitor lands on the hero." },
        "persistence": { "score": "one_time", "reason": "Once a visitor learns what the business sells, the page stops being confusing." },
        "overall_severity": "major"
      },
      "confidence": { "score": "high", "reason": "Three independent sessions reached the same conclusion from the same text." },
      "baseline_comparison": "Bakery and food-shop sites conventionally name the product in the first heading; this site uses a brand slogan only.",
      "remediation": {
        "strategy": "Replace the hero heading with a sentence naming the product and the audience, and add one primary button toward ordering.",
        "effort": "low",
        "copy_changes": [
          { "location": "Hero heading", "before": "Crafted with care since 2009", "after": "Custom cakes and pastries for your celebrations" },
          { "location": "Hero button", "after": "Order a custom cake" }
        ]
      },
      "quick_win": true,
      "found_by": ["S1", "S2", "L2"],
      "gap": {
        "source": "inferred_goal",
        "intended": "Inferred goal: collect custom cake order inquiries.",
        "perceived": "A brand story with no visible product and no visible action."
      },
      "verification": { "status": "verified", "notes": "Re-fetched the home page: hero text unchanged and no product noun in the first 150 words." }
    },
    {
      "verdict": "confirmed",
      "id": "P2",
      "title": "Menu labels are brand-speak and hide the ordering path",
      "category": "navigation",
      "description": "The main navigation uses 'Our Craft', 'Collections' and 'Atelier'. Custom cake ordering sits under Atelier > Bespoke Orders, and no header button points to it.",
      "user_impact": "Visitors who want to order must guess which label leads there. One persona needed eight steps for a three-step task and another signed up for the newsletter believing it was the order form.",
      "root_cause": "The main menu names sections after the brand's own vocabulary, which sends customers to the wrong page when they look for cakes or ordering.",
      "intended_behavior": "The labels are meant to feel premium and consistent with the brand; they work only for people who already know the business.",
      "heuristic_refs": ["NN-2", "NV-02", "CL-06"],
      "evidence": [
        { "kind": "observed", "tier": "text", "url": "https://brightleaf-bakery.example/atelier", "location": "Main navigation, 'Atelier' item", "session": "S1", "log_ref": "S1-E03",
          "excerpt": "The Atelier", "description": "The first-time visitor opened Atelier hoping for ordering and found a photo page with no ordering information." },
        { "kind": "observed", "tier": "text", "url": "https://brightleaf-bakery.example/", "location": "Footer newsletter block", "session": "S2", "log_ref": "S2-E03",
          "description": "The low-literacy persona signed up for the newsletter believing it was how to order a cake." },
        { "kind": "observed", "tier": "text", "url": "https://brightleaf-bakery.example/", "location": "Main navigation labels", "session": "L1", "log_ref": "L1-E01",
          "description": "NN-2 fails: none of the five labels uses the words customers use when they look for cakes or ordering." }
      ],
      "reproduction": {
        "steps": ["Open the home page.", "Without reading anything else, choose the menu item you expect to lead to ordering a birthday cake.", "Follow it and note where you end up."],
        "expected": "The first click lands on a page about ordering a cake, in three steps or fewer.",
        "actual": "The first click lands on Collections or Atelier; reaching Bespoke Orders took eight steps for one persona and was never reached by another."
      },
      "affected_personas": ["first-timer", "low-literacy"],
      "severity": {
        "impact": { "score": "blocking", "reason": "One persona completed the wrong action instead of the order." },
        "frequency": { "score": "common", "reason": "Two of the three personas were affected on the site's primary task." },
        "persistence": { "score": "one_time", "reason": "Once the path is learned it is easy, but most visitors arrive without that knowledge." },
        "overall_severity": "major"
      },
      "confidence": { "score": "high", "reason": "Three independent sessions, including one lens audit, point at the same labels." },
      "baseline_comparison": "Local shop sites conventionally label the ordering route in plain words ('Order a cake', 'Cakes') and keep a persistent order button in the header.",
      "remediation": {
        "strategy": "Rename the menu items in customer vocabulary and add a persistent 'Order a cake' button in the header.",
        "effort": "low",
        "copy_changes": [
          { "location": "Main navigation", "before": "Atelier", "after": "Custom cakes" },
          { "location": "Main navigation", "before": "Collections", "after": "Cakes and pastries" },
          { "location": "Header", "after": "Order a cake" }
        ]
      },
      "quick_win": true,
      "found_by": ["S1", "S2", "L1"],
      "verification": {
        "status": "corrected",
        "notes": "One of three personas completed the task, so the problem slows and misleads users rather than preventing the task outright.",
        "corrections": ["overall_severity: blocker -> major"]
      }
    },
    {
      "verdict": "confirmed",
      "id": "P3",
      "title": "No phone number, email or address to contact the business",
      "category": "trust",
      "description": "The contact page offers a form only. No phone number, email address or postal address appears on the contact page or in the footer.",
      "user_impact": "Customers who prefer to call, and customers who want proof the business exists before paying a deposit, have no way to do either.",
      "root_cause": "The contact page offers only a form, which leaves buyers who want to call or verify the business with no route.",
      "intended_behavior": "The form is meant to keep enquiries organised; it works for people who are comfortable submitting personal details to an unverified business.",
      "heuristic_refs": ["TR-02"],
      "evidence": [
        { "kind": "observed", "tier": "text", "url": "https://brightleaf-bakery.example/contact", "location": "Contact page body", "session": "S3", "log_ref": "S3-E02",
          "description": "The skeptical buyer looked for a phone number or address to verify the business and found only a form." },
        { "kind": "observed", "tier": "text", "url": "https://brightleaf-bakery.example/", "location": "Footer", "session": "S2", "log_ref": "S2-E04",
          "description": "The low-literacy persona looked through the header, contact page and footer for a number to call and gave up." },
        { "kind": "observed", "tier": "text", "url": "https://brightleaf-bakery.example/contact", "location": "Contact page body", "session": "L2", "log_ref": "L2-E03",
          "description": "TR-02 fails: the only contact route is a form." }
      ],
      "reproduction": {
        "steps": ["Open the Contact page.", "Look for any phone number, email address or postal address on the page.", "Scroll to the footer and look again."],